{
  "schema_version": 1,
  "job_id": "00000000-0000-4000-8000-000000000011",
  "paper_id": "00000000-0000-4000-8000-000000000002",
  "intent": "draft_paragraph",
  "source_versions": {
    "story": {
      "revision_id": "00000000-0000-4000-8000-000000000020",
      "sha256": "106766dea408e779464da083ae58ad76af85fbffbb4d3d74e9a8ac7c3a6cf17e"
    },
    "outline": {
      "revision_id": "00000000-0000-4000-8000-000000000021",
      "sha256": "966da0a15bd5fd48a8f4bc437a2b35dd3dc82cfff0f84ef0e8bc698976fac0d2"
    },
    "document": {
      "revision_id": "00000000-0000-4000-8000-000000000022",
      "sha256": "e1b8b56ea6af40d9286d3f4f28177013b6f671a5f6ec78319f67621f4a93b37b"
    },
    "profile": {
      "revision_id": "00000000-0000-4000-8000-000000000023",
      "sha256": "d11e81bc8942960c211bce52582136c6852e1131625828cefe5c9b5412062d07"
    }
  },
  "completed_action_ids": [
    "00000000-0000-4000-8000-000000000030"
  ],
  "pending_step": "Generate a proposal for the approved paragraph node; do not apply it.",
  "provider_binding": {
    "provider": "mock",
    "native_session_id": "synthetic-session-1",
    "capability_snapshot_id": "00000000-0000-4000-8000-000000000031"
  },
  "state": "WAITING_QUOTA",
  "created_at": "2026-10-08T00:00:00Z",
  "summary_note": "Convenience only. Reload authoritative approvals and facts from referenced records."
}
